# The following lines are creating the individual reviews for several products in the catalog with settings at the design level,,,,,,,aaron.mcdonald@mailinator.com,0,Surfs up! I love November!,"Welcome to my surfing community, where the water is always warm and okay. I burned myself out on the whole creative writing gig with the community about page. I love surfing as much as anything else on this planet, and I look forward to sharing my adventures with you. If you haven't ever surfed, get on a board. All of you floating around out there in the communities who are down to ski, snowboard, skateboard, or longboard should definitely catch a wave any chance you can get. The transition isn't that difficult as long as you have the core/balance that it takes to carve the side of a mountain at a decently high speed.",iStock_000018355964Small.jpg,"Why do I love November? I'll tell you why: the North Shore. This is when Oahu becomes the premier surf spot in the world. The waves don't get better than the stretch of beaches (about 7 miles) on the North Shore in November and usually through February, but November through December is definitely prime. Santa got it wrong by posting up in the North Pole.","Anyway, I booked my ticket to leave right after Christmas. Can't wait!",aaron.mcdonald@mailinator.com,1,Reply,P.S. What do you think of my new Pipeline shorts?,iStock_000012787633Small.jpg,,,rebekah.larsen@trashymail.com,1,Reply,"Nice shorts! Okay this may be a dumb question, but where is the North Shore?",,,,james.devore@spambob.com,1,Reply,"There are no stupid questions in the community! Here is a map of the North Shore. From end-to-end, the North Shore is considered one of the best places on the planet to surf. It's a really beautiful area to visit if you've never been.",,,,QnA,/content/geometrixx-outdoors/en/support/jcr:content/par/forum.social.json,,,,,,aaron.mcdonald@mailinator.com,0,Slopeside Jacket,"Is there a waterproof rating for the Slopeside jacket, and are the seams taped?",,,,jason.werner@dodgit.com,1,Reply,"Aaron, I was in the same boat as you when looking at this jacket. I ended up deciding to just buy the jacket and hope that it came with all the info I needed to make an educated decision and either keep it or send it back for something else. This is what the Slopeside gives you: -Guaranteed waterproof to 10,000 mm -Guaranteed breathability to 10,000 g/m2 -Critically taped 13mm seams Now that's a nice jacket. Needless to say, I kept mine.",iStock_000018314658Small_edit.jpg,,,weston.mccall@dodgit.com,1,Reply,"I got last season's version of this jacket and took it up the mountain at least 60 times. If this one is anything like the last one, you will be happy with the waterproof rating. I had zero problems with it, even when I got stuck on the lift one time and was sitting/leaning on it for half an hour straight in a snowstorm. That's about all you need.",,,,aaron.mcdonald@mailinator.com,2,Answer,,,,,james.devore@spambob.com,1,Reply,"Sounds like you're going to hear nothing but greatness about this jacket. I will give the Slopeside my own personal waterproof rating of _built like a brick house.' I have taken this everywhere from snowboarding to hiking in a downpour to sitting in the rain at an outdoor concert. Not only is it completely waterproof, but also I never get too hot or clammy because it ventilates so well.",,,,ryan.palmer@spambob.com,1,Reply,I'm happy to hear all of you have great things to say about your jackets because mine was a huge disappointment. The seams leak like crazy. I'm so happy because now I know I got a dud_definitely using my warranty and sending mine back for a replacement.,,,,emily.andrews@mailinator.com,0,Blackcomb Gloves,Do the Blackcomb gloves have a pocket for hand warmers?,,,,boyd.larsen@dodgit.com,1,Reply,Nope. You need to spend about $100 to get a hand warmer pouch.,,,,aaron.mcdonald@mailinator.com,1,Reply,You can just shove the hand warmer in the glove without the pocket!,,,,felicia.carter@trashymail.com,1,Reply,"These gloves do not have hand warmers, but I have found with them that you don't really need the warmers, and I consider myself one to get cold pretty easily, especially in my fingers and toes. The gloves are completely waterproof and have a great drawstring that helps to keep snow out and your body heat out.",,,,emily.andrews@mailinator.com,2,Answer,,,,,jason.werner@dodgit.com,1,Reply,"If you don't want to spend the extra money for gloves with a warmer pouch, I would suggest taking a pair of one-size-fits-all-liners (if you don't already have some, they cost $2 just about anywhere) and wearing them under your gloves. This way, you can slide the hand warmer between the gloves and not risk irritating your hands. The only drawback is, of course, if you need to grip anything like ski poles the warmers will get in the way. Good luck!",,,,weston.mccall@dodgit.com,0,Lagos mini longboard,Is the Lagos mini longboard surfboard epoxy or fiberglass?,,,,ashley.thompson@spambob.com,1,Reply,The Lagos is made of epoxy and does not contain any fiberglass.,,,,aaron.mcdonald@mailinator.com,1,Reply,"The Lagos is an all-epoxy, super light board. Thats a good question that I think a lot of people overlook when shopping around for their first board, so good looking out. In addition to the Lagos being a lot lighter than a glass board, it is also way stronger which is an important consideration if you plan on being bad for a while (kidding). Overall, I recommend epoxy. Its more buoyant and if you are one to care about the environment, epoxy decomposes a lot faster than traditional glass. My friend has a GoPro and got this awesome picture of me on my board (its epoxy).",iStock_000008387990Small_edit.jpg,,,weston.mccall@dodgit.com,2,Answer,,,,,donna.billups@pookmail.com,1,Reply,"You may also want to check out NexGen. It's like epoxy, but crazy light without any stiffness.",,,,aaron.mcdonald@mailinator.com,1,Reply,Donna is right about NexGen as long as you are okay shelling out big $$$.,,,,emily.andrews@mailinator.com,0,m2121 pedals,"I would be interested in buying the M2121 pedals, but I need to know what type of cleats they pair with first. Any help?",,,,josh.bradley@pookmail.com,1,Reply,"The M2121 pedals take a standard MTB cleat. Fortunately, you don't even have to worry about any of that. The pedals are actually packaged with the cleats! All you need to do is buy these pedals and then some MTB compatible shoes. Sometimes, the shoes will come with the cleats as well, depending on the brand. This is handy because you will wear the cleats out. I have the M2121 and this is a picture of my setup.",iStock_000010857602Small.jpg,,,emily.andrews@mailinator.com,2,Answer,,,,,andrew.schaeffer@trashymail.com,0,Longirod Trek hiking poles,"I am having trouble with my Longirod Trek hiking poles. I tighten the extension locks as tight as I can, but they still loosen up after only an hour of use. Is there a trick to this that I need to know about? Is this a defect that is covered by my warranty?",,,,jason.werner@dodgit.com,1,Reply,"I can't really tell with the picture, so you'll have to tell me if the pole extensions have a twist and lock or a lever clamp.",,,,andrew.schaeffer@trashymail.com,1,Reply,They twist and lock to tighten at two different points on the telescope.,,,,jason.werner@dodgit.com,1,Reply,"In that case, you may have just bought a pair of poles that can't do what you expect them to, which is to stay tight for an entire hike. The twist and lock poles are kind of an outdated technology as far as poles are concerned. The threads inside the locking mechanism are just asking to get worn out or stripped every time you make an adjustment. It's a catch 22. If you don't tighten the poles tight enough, they don't stay at the height they are supposed to. If you tighten the poles too tight, every time you do the threads will become less effective. I would recommend finding a pair of poles that have the FlickLock system. You simply pull a lever out from the pole to adjust, and then clamp it back down to tighten, much like the quick-release lever on bicycle tires and seats.",,,,andrew.schaeffer@trashymail.com,2,Answer,,,,,aaron.mcdonald@mailinator.com,1,Reply,"I agree with Jason on this one, except that there are twist and lock poles out there that actually do work and last a long time. They are called $250 poles. But honestly, if you are going to spend the money, get the FlickLock.",,,,emily.andrews@mailinator.com,1,Reply,"Andrew, we are sorry that you are having trouble with your Longirod Trek poles. The locking mechanism is covered by your warranty. You can either receive a full refund or get replacement poles if yours are defective. We have already emailed you detailed information about getting this issue resolved at your convenience.",,,,weston.mccall@dodgit.com,1,Reply,"In addition to FlickLock, look into poles with the SLS system. This type of extension has an expander/screw combination that you could lean on with your full body weight, and it's not going to go anywhere. I've been using poles with SLS for a few years now for both summer and winter hiking (my buddy took this picture of me while we were out last time) and I have had zero complaints.",iStock_000019572344Small.jpg,,,rebekah.larsen@trashymail.com,0,Aqua Force GPS,Does anyone know if the Aqua Force GPS monitor can log multiple runs?,,,,josh.bradley@pookmail.com,1,Reply,"Yes. The Aqua Force is capable of storing four runs at a time. Your runs logged will detail the time of the run, distance traveled, and elevation gained or lost. It's a pretty handy little function that I use all the time.",,,,rebekah.larsen@trashymail.com,2,Answer,,,,,felicia.carter@trashymail.com,0,Pufferfish fins,"I would like to know the materials used in the Pufferfish fins. Unfortunately, I am allergic to silicone and need to make sure the skirt and strap around the ankle won't be a problem for me.",,,,emily.andrews@mailinator.com,1,Reply,"The Pufferfish fins do use silicone, so if you have a silicone allergy then we recommend not purchasing this product. We currently do not have a silicone free fin set, but your question has been forwarded to our procurement department so that we can hopefully offer you an alternative in the future.",,,,josh.bradley@pookmail.com,1,Reply,"One of my kids has a silicone allergy, so fortunately for you I have already done the research on this! If you are out there looking for snorkeling fins, you won't find much in the silicone free department. However, if you look around for SCUBA fins, you will find a pretty decent selection. The SCUBA fins will offer a heel strap that clicks to tighten, and is made entirely of plastic. The only drawback: you will need to wear neoprene dive boots. They are quite comfy and keep your feet warm, but it is another expense.",iStock_000017623596Small.jpg,,,felicia.carter@trashymail.com,2,Answer,,,,,felicia.carter@trashymail.com,1,Reply,"Josh, thanks for the reply. I will definitely look into getting SCUBA fins. I've already accepted the fact that I will have to pay extra on a few things here and there because of my allergy, and this option doesn't sound unreasonable at all. I'm wondering if I can just buy the booties and wear them with silicone snorkeling fins since my skin wouldn't come in contact with the fins at all. Maybe that would save me some money_..",,,,josh.bradley@pookmail.com,1,Reply,"Felicia, unfortunately that will not work. Snorkeling fins are generally too narrow around the ball of your foot to allow for a bootie. It would be pretty uncomfortable if it were even possible, in my opinion.",,,,weston.mccall@dodgit.com,0,Whistler Snowboard,"If I buy the Whistler Snowboard, can I switch out the bindings or am I stuck with the ones it comes with?",,,,aaron.mcdonald@mailinator.com,1,Reply,"The Whistler is compatible with just about any binding setup out there, with the exception of Burton. If you get the Whistler, you will have four screw holes to attach the baseplate to, which is almost universal (Burton only has three holes).",,,,weston.mccall@dodgit.com,2,Answer,,,,,ryan.palmer@spambob.com,1,Reply,I changed out the bindings when I got the Whistler because I don't like the straps (they bother my ankles). I had no issues attaching my step bindings.,,,,ashley.thompson@spambob.com,0,Sequoia helmet,I would like to know if there is an impact rating for the Sequoia helmet. Does anyone know where I can find this info?,,,,ryan.palmer@spambob.com,1,Reply,"I bought this helmet, and on the packaging it reads, _The Sequoia is made of a fully reinforced, singular structure that disperses impact across multiple nerves between the vents for maximum protection. It doesn't say anything specific about an impact rating, like a numerical value, but I hope that helps.",,,,aaron.mcdonald@mailinator.com,1,Reply,"Our helmets are put through rigorous impact tests to ensure that all our products meet the most stringent safety standards. To test our helmets, we drop each one from a minimum of 7'_so that it reaches at least 20 ft./sec_and measure the results as per safety regulations published by the U.S. Consumer Product Safety Commission Requirements for Bicycle Helmets. Every helmet, including the Sequoia, meets or exceeds the Commission's pass/fail test for impact, as well as chinstrap safety and peripheral vision testing. We hope this information helps.",,,,ashley.thompson@spambob.com,2,Answer,,,,,ashley.thompson@spambob.com,0,Warranty issue,"What do I do if I need to use my warranty, but I can't find my documentation anywhere?",,,,aaron.mcdonald@mailinator.com,1,Reply,"If you misplaced or threw away your warranty information, simply contact us and tell us what product you need warranty info for as well as your purchase date. We'll take care of the rest! Email: info@geometrixx.com Phone: 801-555-1081",,,,ashley.thompson@spambob.com,2,Answer,,,,,josh.bradley@pookmail.com,1,Reply,"I had to contact Geometrixx to obtain warranty information for a water bottle. I opted to email instead of call, and I still had the information I needed, in hand, less than 24 hours later. You can't ask for better customer service.",,,,donna.billups@pookmail.com,1,Reply,Merci pour toutes ces informations ! Cela m'est tres utile.,,,,