# The following lines are creating the individual reviews for several products in the catalog with settings at the design level,,,,,,,ashley.thompson@spambob.com,0,International surfing,"I am planning a vacation, and I have gotten as far as 1) I'm getting my passport stamped and 2) I'm going to sit my butt on a warm beach. After reading up on this community, I have a sudden itch to try out surfing. Since I will be leaving the country, Hawaii is not on my list of destinations. Plus, I will be going next spring and from what I can tell the waves aren't so fantastic then anyway. Does anyone have any suggestions as to where I should go? I'm pretty open to anything.",,,,aaron.mcdonald@mailinator.com,1,Reply,"Australia and South Africa immediately come to mind, but you do have to deal with the Great White population and I don't know how you feel about that. I would suggest going down to Bali. The city isn't the greatest place in the world to visit, but the beaches and surfing are world class.",,,,felicia.carter@trashymail.com,1,Reply,"I read that even if you surf all the time, you are still more likely to get struck by lightening than get attacked by a shark.",,,,ryan.palmer@spambob.com,1,Reply,"I'm not much of a surfer, but I do know that France is known as the surfing capitol of Europe. However, if you want the whole tropical beach experience, go to Cloud Nine in the Philippines.",,,,# The following lines are creating the calendar component and the associated content for the Community Groups in Outdoors,,,,,,,Calendar,/content/geometrixx-outdoors/en/community/hiking/calendar/jcr:content/par/calendar.social.json,,,,,,aaron.mcdonald@mailinator.com,0,Hiker's Corner,"This month, we will be discussing avalanche safety. The snow season is just around the corner, and I know a lot of you really enjoy snowshoeing, so let's all prepare for a safe season. We will discuss common warning signs of an avalanche and what to do if you are caught in one, and we will also go through a first aid/CPR refresher.",City Center YMCA,YYYY-MM-01T20:00:00.000Z,YYYY-MM-01T22:00:00.000Z,aaron.mcdonald@mailinator.com,0,Movie Night: The Mountain,"The Superplex is showing The Mountain for their Saturday Throwback movie this month. For those of you who don't know, this 1956 classic is about two brother who hike a mountain to the site of a plane crash, but each brother has their own motives. Suspenseful. Fun. Don't miss out.",Superplex Movies 21,YYYY-MM-08T19:00:00.000Z,YYYY-MM-01T21:30:00.000Z,aaron.mcdonald@mailinator.com,0,Hiker community food drive,"Hey everyone, hope you're all doing well. As we look forward to the holiday season, I think it would be a great idea to all pitch in and help out those in need. Even if we aren't rich and glamorous, a few cans of food here and there, or maybe an old jacket or blanket that you won't use anymore can go a long way toward helping brighten someone else's day. My family and I will be posted up at the library pretty much all day long, so please fell free to stop by whenever you get a moment.",City Library,YYYY-MM-19T08:00:00.000Z,YYYY-MM-19T12:30:00.000Z,aaron.mcdonald@mailinator.com,0,Slaughter Canyon Cave,"I would like to get a group together to hike Slaughter Canyon Cave at Carlsbad. It is a strenuous hike, but it should only take us about 2 hours. From there you can explore, enjoy the park, and do pretty much whatever you want. Since it's in a national park, there are strict hike times_we need to be there ready to go at 8:00am. Also, there is a 25-person limit to each group, so it is a first-come-first-serve event. Let me know if you're interested.",City Center YMCA,YYYY-MM-18T19:00:00.000Z,YYYY-MM-18T20:30:00.000Z,aaron.mcdonald@mailinator.com,0,Meet at my place to hit the road,"This one is for the diehards! We're headed out to the Columbia River Gorge for a 5 night, 60-mile hike. We ask that if you decide to join this hike, you have hiked at least 3 days carrying all your gear and food. This is a difficult hike, so if you are considering joining, please grab a topo map and give the trail a good review before you make your final decision. I would like to look into scheduling at least three meet-ups before hand so we can discuss gear, safety, etc. Let me know if you're interested.",Mark O. Hatfiled hike,YYYY-MM-07T10:00:00.000Z,YYYY-MM-07T09:30:00.000Z,Calendar,/content/geometrixx-outdoors/en/community/running/calendar/jcr:content/par/calendar.social.json,,,,,,aaron.mcdonald@mailinator.com,0,Weekly run group,Time to work off the holidays! We're back in action for nine miles around the park. Let's all meet where Market turn to Guadalupe.,San Bruno Park,YYYY-MM-01T20:00:00.000Z,YYYY-MM-01T22:00:00.000Z,aaron.mcdonald@mailinator.com,0,Run Group Christmas Party!,"Happy holidays! Take a break and enjoy it while it lasts! Meet at my place for wine and snacks. You don't have to bring anything, but you are more than welcome to if you would like.",Rebekah's house,YYYY-MM-08T19:00:00.000Z,YYYY-MM-01T21:30:00.000Z,aaron.mcdonald@mailinator.com,0,Christmas Food Bank,"Come down to the Warf with me to help the food bank. Bring some cans of food, and stick around to help sort items for delivery. Afterward we can all get some dinner and drinks.",Fisherman's Warf,YYYY-MM-19T08:00:00.000Z,YYYY-MM-19T12:30:00.000Z,aaron.mcdonald@mailinator.com,0,Wildcat Canyon,"This week is a short run, so we will meet at the south entrance on the edge of Berkeley and run north to Tilden and back for about six miles.",John McLaren Park,YYYY-MM-18T19:00:00.000Z,YYYY-MM-18T20:30:00.000Z,aaron.mcdonald@mailinator.com,0,Run with me in the Napa Valley 5k,"I know it's a bit of a drive to get there, but I figured we could carpool and the proceeds of the race go to charity so I think its worth going out for. Get in touch if you're interested.",Napa Valley,YYYY-MM-07T10:00:00.000Z,YYYY-MM-07T09:30:00.000Z,aaron.mcdonald@mailinator.com,0,Weekly run group,"This week is a short run, so we will stay in the park and put in four miles.",John McLaren Park,YYYY-MM-21T10:00:00.000Z,YYYY-MM-21T09:30:00.000Z,aaron.mcdonald@mailinator.com,0,Monthly social,"Okay everyone, this month it's all on me. I'm not going to tell you what we're doing, but we'll hang out at my place for a few drinks before we go out for a bit, so bring warm clothes!",James' house,YYYY-MM-23T10:00:00.000Z,YYYY-MM-07T23:30:00.000Z,aaron.mcdonald@mailinator.com,0,Weekly run group,"This week we will begin our run at the Sausalito Harbor. I plan on taking us across the bridge and into the Mission District before heading back. This is a long day, so total run should be about 14 miles.",Sausalito Harbor,YYYY-MM-30T10:00:00.000Z,YYYY-MM-30T09:30:00.000Z,Calendar,/content/geometrixx-outdoors/en/community/surfing/calendar/jcr:content/par/calendar.social.json,,,,,,# The following lines are creating the journal component and the associated content for the Community Groups in Outdoors,,,,,,,Journal,/content/geometrixx-outdoors/en/community/surfing/blog/jcr:content/par/journal.social.json,,,,,,donna.billups@pookmail.com,0,The Super Bowl of surfing,"Aaron thanks a ton for creating this community. I was thinking about doing the same, but then I thought that we wouldn't get the numbers. I look forward to many great discussions with you and anyone else who is passionate about surfing.",,"I would be jealous of your trip out to Oahu, but I've got my own vacation lined up. In fact, I'm packing right now to go hang out and watch the pros at the Triple Crown. I'll get some time in on the waves, too, but I love to watch the best in the world tear it up. It's amazing what they can do. It's an art.","So, I'll be in Hawaii for three weeks. In addition to the popular spots like Sunset Beach and Waimea, I also plan on hitting up the Banzai Pipeline. I have been hesitant in years past because it is a rather dangerous spot, but I'm feeling pretty confident this year.",Ha ha. Kidding. I'm not going to get myself killed. I'll take pics of the pipeline but that's it. Please let me know how your trip goes and I will be sure to post some pictures when I get back!ashley.thompson@spambob.com,1,Reply,"Sounds like so much fun! I'm a SCUBA diver myself, so I can't help but tell you that you've got to check out Electric Beach while you're there amazing place.",,,,aaron.mcdonald@mailinator.com,0,Surfs up! I love November!,"Welcome to my surfing community, where the water is always warm and okay. I burned myself out on the whole creative writing gig with the community about page. I love surfing as much as anything else on this planet, and I look forward to sharing my adventures with you. If you haven't ever surfed, get on a board. All of you floating around out there in the communities who are down to ski, snowboard, skateboard, or longboard should definitely catch a wave any chance you can get. The transition isn't that difficult as long as you have the core/balance that it takes to carve the side of a mountain at a decently high speed.",iStock_000018355964Small.jpg,"Why do I love November? I'll tell you why: the North Shore. This is when Oahu becomes the premier surf spot in the world. The waves don't get better than the stretch of beaches (about 7 miles) on the North Shore in November and usually through February, but November through December is definitely prime. Santa got it wrong by posting up in the North Pole.","Anyway, I booked my ticket to leave right after Christmas. Can't wait!",aaron.mcdonald@mailinator.com,1,Reply,P.S. What do you think of my new Pipeline shorts?,iStock_000012787633Small.jpg,,,rebekah.larsen@trashymail.com,1,Reply,"Nice shorts! Okay this may be a dumb question, but where is the North Shore?",,,,james.devore@spambob.com,1,Reply,"There are no stupid questions in the community! Here is a map of the North Shore. From end-to-end, the North Shore is considered one of the best places on the planet to surf. It's a really beautiful area to visit if you've never been.",,,,Journal,/content/geometrixx-outdoors/en/community/hiking/blog/jcr:content/par/journal.social.json,,,,,,rebekah.larsen@trashymail.com,0,Best GPS for hiking?,"I want to buy my husband a GPS navigator as a gift. He is an avid hiker and is always talking about how great it would be to have one. I don't know a lot about the technology or options available out there, and I am hoping for a little advice backed by experience.",,,,andrew.schaeffer@trashymail.com,0,Enjoying the redwoods,"I remember visiting the redwood forests in Northern California as a kid with my family, but I got the sudden urge to go back and see them for myself, the way I want to see them hiking!",iStock_000014804090Small.jpg,"I have got to say, if you haven't ever done this before, you need to make the trip. The trees are incredible. They make you feel almost like you're on a different planet. I decided that if I went I wanted to see the granddaddy of them all the Hyperion. This is the tallest tree in the world, and stands at 379'. It's quite a hike. I think it ended up being about 16 miles round trip, so it ends up being a camping hike unless you're an animal.","Anyway, I've stood at the base of the Empire State Building and the Sears Tower, and nothing compares to standing next to this tree.",ashley.thompson@spambob.com,1,Reply,Andrew I'm jealous! I have always wanted to do that since they discovered the tree in 2006. You are my motivation! I will try to do that next summer.,iStock_000008274917Small.jpg,,,james.devore@spambob.com,1,Reply,"Good for you, man. How strenuous is the hike?",,,,andrew.schaeffer@trashymail.com,1,Reply,"It's not that bad, if you are used to hiking with an overnight pack on your back. I actually like the feel of carrying weight on my back for some reason (even with biking, too .I know I'm strange) so I didn't have any problems. It never got too steep to ruin the experience, that's for sure. Plus, the scenery along the way is incredible so you've got plenty of distractions.",iStock_000014804091Small.jpg,,,weston.mccall@dodgit.com,0,I finally gave in and got poles.,"For anyone out there who may know me and has even hiked with me, you will know that I am what most people would consider to be a minimalist hiker. Running shoes, basketball shorts, and a t-shirt are about all I need to get by. However, if you know me that well you will also know that I have had a small knee issue lately, especially when it comes to long stretches of downhill trail.",iStock_000013521207Small.jpg,"I have believed, and always will believe that the best way to enjoy nature is without all the expensive gear and latest hiking ""technology."" We didn't need it before it existed, and we certainly don't need it now. That said, when my knees started causing problems, I opted for a nice, sturdy hiking stick off the side of my favorite local trail. However, my wife decided that she would still buy me a set of hiking poles, and insisted that I try them at least once.","Okay. So. Maybe the technology guys are on to something. After one eight-mile hike with the Longirod Trek hiking poles, my knees felt 10 years younger. I'm still a minimalist, but I think there is room for one exception.",james.devore@spambob.com,1,Reply,"Weston, good call on giving in to your wife and using poles. I had a similar experience a few years ago, and now I don't go on a hike without them. Sometimes I will just have them with me and not actually use them, but they are always good to have around. It sounds like you aren't one to hike with a daypack, but I have a pack with a place to strap my poles on the outside, so it's not an inconvenience at all.",iStock_000010408398Small.jpg,,,ryan.palmer@spambob.com,1,Reply,"Weston, I did s lot of research on this. For those who would like to know, a very exhaustive study found that hiking (or trekking) poles reduce stress on lower joints by as much as 25%, help extend muscle endurance, and decrease soreness the next day. Needless to say, I never hike without mine.",iStock_000016981909Small.jpg,,,felicia.carter@trashymail.com,0,Yellowstone in the fall,"My family and I just returned from a trip up to Yellowstone National Park. A family that hikes together stays together _ All our kids are grown now, so we can do some of the more strenuous hikes. We decided to take on Sepulcher Mountain, an 11-mile, all-day hike with a 9,600' summit. This was my first time on this trail, and I can't even begin to tell you how beautiful it was.",iStock_000011800026Small.jpg,"We definitely chose to go at the right time of year. The leaves are absolutely incredible, and the fire season is far enough behind us that the air up there is crisp and clear as can be. Has anyone else hiked Sepulcher? If you are interested or have any questions about the hike, I would be happy to chat with you. One thing to consider: this is a_cold_hike.",,emily.andrews@mailinator.com,1,Reply,"Sounds like fun! I can usually handle cold hikes, and I am getting better about layering so I have everything I need, but I'm not packing too much on my back at the same time. Is it windy, too? Or just cold?",,,,josh.bradley@pookmail.com,0,Gearing up for my Kili hike.,"Hey everyone, my name is Josh and this is my first post in the hiking community. I just wanted to first say thanks to Jason for organizing this community, and that I also could not agree more with what you said about how friendly hikers are, in general. That, too, is one of the reasons I enjoy hitting the trail as often as I do.",iStock_000004737970Small.jpg,"Anyway, for the past year I have been planning and organizing my first trip to Africa, where I will be hiking Mt. Kili in Tanzania. I've gotta say, I kind of didn't know what I was getting myself into! Even though we (I am taking my son) will be renting a decent amount of equipment from our guide company like our tent, sleeping bags, hiking poles, and cookware, it is still amazing how much we have to bring. I'm a little worried about making it all fit with all the bag restrictions.","Anyway, we leave in a little over a month, and I don't want this to become a ""bad stress"" type of thing, so if there is anyone out there who has some pretty good advice, I would be grateful. Thanks.",donna.billups@pookmail.com,1,Reply,"Josh, I'm glad to hear you and your son are taking on Mt. Kilimanjaro. I have actually summited twice and I hope to make it back again in the next few years. The biggest piece of advice I can offer to you is to NOT cut back on essentials because you think you are taking too much. Even if you have to pay extra baggage fees, it is well worth the $20. It is far better to be over-prepared. Talk to your guide company the day before you set out. If they tell you that you brought too much, just about every hotel out there will store your stuff for a minimal fee while you're on the mountain. Did your guide company provide you with a packing list?",iStock_000014674004Small.jpg,,,josh.bradley@pookmail.com,1,Reply,"Thanks for the reply, Don. That is good advice. Yes, I have a comprehensive list of items to bring. They even have ""comfort food"" on the list. Ha ha.",iStock_000021716747Small.jpg,,,donna.billups@pookmail.com,1,Reply,"Josh, don't underestimate the value of comfort food. When you reach day four and you're cold and tired and maybe what they cook doesn't exactly sit well with you, having that candy bar or snack or whatever you bring along with you can be the best thing that ever happened to you.",,,,jason.werner@dodgit.com,0,Thanks for dropping by the hiking community.,"I'm glad you decided to stop by and see how things are going in the hiking community. I organized this community knowing that it would be a great place for fellow hikers to gather and discuss anything and everything related to one of the greatest outdoor past times ever. The more people contribute, the more successful this community will be, so don't be shy.",,"One of my favorite aspects of hiking goes beyond even the most breathtaking views of nature that I have come across over 30 years on the trail. I am, of course, speaking about how great all of you out there are to be around. It is very rare to find an activity or hobby in life (especially a sport) where it seems that just about every participant is just as nice and welcoming as the last. Whether we exchange a simple ""hello"" or ""good morning,"" or we chat about the trail and share some personal knowledge, I am always happy to come across a fellow hiker enjoying his or her day.","So, like I said, don't be shy. We're all excited to hear from you!",felicia.carter@trashymail.com,1,Reply,Thanks Jason! I look forward to visiting the community often.,,,,ryan.palmer@spambob.com,1,Reply,"Jason, you're the man. Don't forget we're on for a 10-mile this weekend.",,,,Journal,/content/geometrixx-outdoors/en/community/winter-sports/blog/jcr:content/par/journal.social.json,,,,,,boyd.larsen@dodgit.com,0,A skier makes the switch,"Call me traditional. Call me old school. I've been a skier all my life, and proud of it. However, I_finallydecided that this is the year I make the switch. I've never strapped into a snowboard, but I'm going to give it a shot.",iStock_000017848775Small.jpg,"I think it's a good thing that I have waited so long. Now that I have had an outside perspective of snowboarders, watching them on the mountain while I'm on my skis, I think that I will be better off. For instance, I won't just stop in the middle of the run and plant my butt in the snow, because I already know that oncoming skiers get really, really frustrated when that happens!","I am incredibly curious to see how it will be having my feet basically locked together_a new experience, indeed. Who else out there was a skier first who then took up snowboarding?",donna.billups@pookmail.com,1,Reply,"Boyd, if you're anything like me, you have nothing to worry about. Sure, you're going to fall a few times (maybe more than a few times) but if you're comfortable on the snow, and you're an experienced skier, you should pick it up pretty quickly.",,,,andrew.schaeffer@trashymail.com,1,Reply,"Don't crash! Really though, you have nothing to worry about. Remember how when you started skiing you most likely had someone connect your skis together so you could plow down the mountain and learn how to stop? You just need to first learn how to use your heels to stop on your board (this is where you will probably fall over a few times) and then everything else will come naturally.",,,,weston.mccall@dodgit.com,1,Reply,"Are you buying a snowboard or just renting for the first few times? If you are looking to buy, I would suggest checking out the Whistler Snow snowboard. It's a fantastic board at a great price, and a good option for ""beginners.""",,"Almost all the ski resorts in Utah are scheduled to open early this year due to significant snowpack before Thanksgiving, but with early snow comes moderate to considerable avalanche warnings. Jason is putting together an avalanche safety and first aid/CPR review. I would strongly suggest to everyone over here in winter sports connect with Jason for more info.",,jason.werner@dodgit.com,0,Avalanche season is upon us,"As we gear up for the winter season, and it looks like it will be a good one, remember that safety is always priority #1. Wherever you decide to go, be sure to check with local officials first to see if there are any avalanche warnings in effect.",,"Almost all the ski resorts in Utah are scheduled to open early this year due to significant snowpack before Thanksgiving, but with early snow comes moderate to considerable avalanche warnings. Jason is putting together an avalanche safety and first aid/CPR review. I would strongly suggest to everyone over here in winter sports connect with Jason for more info.",,rebekah.larsen@trashymail.com,1,Reply,What a great idea. Thanks for putting this together. I think everyone in the community will benefit from your advice.,,,,aaron.mcdonald@mailinator.com,1,Reply,Good looking out. We all need to be aware when it comes to avalanches.,iStock_000005331672Small.jpg,,,josh.bradley@pookmail.com,0,Welcome to the winter sports community (and lets talk snowshoes)!,"This is the inaugural journal entry for the winter sports community. I hope that every one of you finds exactly what you're looking for, and if you don't, we'll work hard to make sure you do.",iStock_000019367607Small.jpg,"To begin, I would like to get the conversation started on snowshoeing. Compared to other winter sports, snowshoeing isn't exactly popular, but I'm here to change that! I'm confident that most of you would love breaking through fresh powder on a sunny weekend morning if you just give it a shot.",My son and I are making our own snowshoes this year. It's a great activity and I've spent many years refining my formula for the perfect snowshoe. I'm even going to host a Snowshoeing: 101 class if anyone is interested. Check the calendar for more details.,"Anyway, now you know a little bit more about me. I can't wait to see what this community becomes._"jason.werner@dodgit.com,1,Reply,"Josh, thanks for setting up the winter sports community! Also, thanks for letting people know about the hiking community calendar. I'm sure my kids and I will be interested in your class and maybe even making some snowshoes.",,,,josh.bradley@pookmail.com,1,Reply,That sounds great. Just let me know what you decide.,,,,# The following lines are creating the qna component and the associated content for the Community Groups in Outdoors,,,,,,,QnA,/content/geometrixx-outdoors/en/community/running/questions/jcr:content/par/qnaforum.social.json,,,,,,donna.billups@pookmail.com,0,The Super Bowl of surfing,"Aaron thanks a ton for creating this community. I was thinking about doing the same, but then I thought that we wouldn't get the numbers. I look forward to many great discussions with you and anyone else who is passionate about surfing.",,"I would be jealous of your trip out to Oahu, but I've got my own vacation lined up. In fact, I'm packing right now to go hang out and watch the pros at the Triple Crown. I'll get some time in on the waves, too, but I love to watch the best in the world tear it up. It's amazing what they can do. It's an art.","So, I'll be in Hawaii for three weeks. In addition to the popular spots like Sunset Beach and Waimea, I also plan on hitting up the Banzai Pipeline. I have been hesitant in years past because it is a rather dangerous spot, but I'm feeling pretty confident this year.",Ha ha. Kidding. I'm not going to get myself killed. I'll take pics of the pipeline but that's it. Please let me know how your trip goes and I will be sure to post some pictures when I get back!ashley.thompson@spambob.com,1,Reply,"Sounds like so much fun! I'm a SCUBA diver myself, so I can't help but tell you that you've got to check out Electric Beach while you're there amazing place.",,,,